20:26:38.990894 IP 0.0.0.0.bootpc > 255.255.255.255.bootps: BOOTP/DHCP, Request from 46:ec:e0:f2:42:8e (oui Unknown), length 300
20:26:40.018864 IP 0.0.0.0.bootpc > 255.255.255.255.bootps: BOOTP/DHCP, Request from 3e:46:be:a5:7e:3e (oui Unknown), length 300
20:26:46.103553 IP 0.0.0.0.bootpc > 255.255.255.255.bootps: BOOTP/DHCP, Request from 46:ec:e0:f2:42:8e (oui Unknown), length 300
20:27:05.918410 IP 10.0.0.2.44039 > 10.4.3.2.5001: Flags [.], seq 3764776847:3764778295, ack 2285427011, win 58, options [nop,nop,TS val 7082353 ecr 7081961], length 1448
20:27:05.921230 IP 10.4.3.2.5001 > 10.0.0.2.44039: Flags [.], ack 95568, win 32766, options [nop,nop,TS val 7082353 ecr 7081957,nop,nop,sack 1 {0:1448}], length 0
20:27:05.921365 IP 10.0.0.2.44039 > 10.4.3.2.5001: Flags [P.], seq 461912:477840, ack 1, win 58, options [nop,nop,TS val 7082353 ecr 7082353], length 15928
20:27:05.922637 IP 10.0.0.2.44039 > 10.4.3.2.5001: Flags [.], seq 477840:493768, ack 1, win 58, options [nop,nop,TS val 7082353 ecr 7082353], length 15928
20:27:05.923976 IP 10.0.0.2.44039 > 10.4.3.2.5001: Flags [.], seq 493768:509696, ack 1, win 58, options [nop,nop,TS val 7082353 ecr 7082353], length 15928
20:27:05.925276 IP 10.0.0.2.44039 > 10.4.3.2.5001: Flags [.], seq 509696:525624, ack 1, win 58, options [nop,nop,TS val 7082353 ecr 7082353], length 15928
20:27:05.926596 IP 10.0.0.2.44039 > 10.4.3.2.5001: Flags [.], seq 525624:541552, ack 1, win 58, options [nop,nop,TS val 7082353 ecr 7082353], length 15928
20:27:05.927937 IP 10.0.0.2.44039 > 10.4.3.2.5001: Flags [.], seq 541552:557480, ack 1, win 58, options [nop,nop,TS val 7082353 ecr 7082353], length 15928
20:27:05.941730 IP 10.4.3.2.5001 > 10.0.0.2.44039: Flags [.], ack 95568, win 32766, options [nop,nop,TS val 7082353 ecr 7081957,nop,nop,sack 1 {461912:463360}], length 0
20:27:05.941831 IP 10.4.3.2.5001 > 10.0.0.2.44039: Flags [.], ack 95568, win 32766, options [nop,nop,TS val 7082353 ecr 7081957,nop,nop,sack 1 {461912:464808}], length 0
20:27:05.941922 IP 10.4.3.2.5001 > 10.0.0.2.44039: Flags [.], ack 95568, win 32766, options [nop,nop,TS val 7082354 ecr 7081957,nop,nop,sack 1 {461912:466256}], length 0
20:27:05.941955 IP 10.4.3.2.5001 > 10.0.0.2.44039: Flags [.], ack 95568, win 32766, options [nop,nop,TS val 7082354 ecr 7081957,nop,nop,sack 1 {461912:467704}], length 0
20:27:05.942043 IP 10.4.3.2.5001 > 10.0.0.2.44039: Flags [.], ack 95568, win 32766, options [nop,nop,TS val 7082354 ecr 7081957,nop,nop,sack 1 {461912:469152}], length 0
20:27:05.942076 IP 10.4.3.2.5001 > 10.0.0.2.44039: Flags [.], ack 95568, win 32766, options [nop,nop,TS val 7082354 ecr 7081957,nop,nop,sack 1 {461912:470600}], length 0
20:27:05.944907 IP 10.4.3.2.5001 > 10.0.0.2.44039: Flags [.], ack 95568, win 32766, options [nop,nop,TS val 7082354 ecr 7081957,nop,nop,sack 1 {461912:472048}], length 0
20:27:05.945052 IP 10.4.3.2.5001 > 10.0.0.2.44039: Flags [.], ack 95568, win 32766, options [nop,nop,TS val 7082354 ecr 7081957,nop,nop,sack 1 {461912:473496}], length 0
20:27:05.945139 IP 10.4.3.2.5001 > 10.0.0.2.44039: Flags [.], ack 95568, win 32766, options [nop,nop,TS val 7082354 ecr 7081957,nop,nop,sack 1 {461912:474944}], length 0
20:27:05.945171 IP 10.4.3.2.5001 > 10.0.0.2.44039: Flags [.], ack 95568, win 32766, options [nop,nop,TS val 7082354 ecr 7081957,nop,nop,sack 1 {461912:476392}], length 0
20:27:05.945203 IP 10.4.3.2.5001 > 10.0.0.2.44039: Flags [.], ack 95568, win 32766, options [nop,nop,TS val 7082354 ecr 7081957,nop,nop,sack 1 {461912:477840}], length 0
20:27:05.951433 IP 10.0.0.2.44039 > 10.4.3.2.5001: Flags [.], seq 557480:563272, ack 1, win 58, options [nop,nop,TS val 7082361 ecr 7082353], length 5792
20:27:05.951853 IP 10.0.0.2.44039 > 10.4.3.2.5001: Flags [.], seq 563272:564720, ack 1, win 58, options [nop,nop,TS val 7082361 ecr 7082353], length 1448
20:27:05.951946 IP 10.0.0.2.44039 > 10.4.3.2.5001: Flags [.], seq 564720:566168, ack 1, win 58, options [nop,nop,TS val 7082361 ecr 7082354], length 1448
20:27:05.952063 IP 10.0.0.2.44039 > 10.4.3.2.5001: Flags [.], seq 566168:567616, ack 1, win 58, options [nop,nop,TS val 7082361 ecr 7082354], length 1448
20:27:05.952191 IP 10.0.0.2.44039 > 10.4.3.2.5001: Flags [.], seq 567616:569064, ack 1, win 58, options [nop,nop,TS val 7082361 ecr 7082354], length 1448
20:27:05.952302 IP 10.0.0.2.44039 > 10.4.3.2.5001: Flags [.], seq 569064:570512, ack 1, win 58, options [nop,nop,TS val 7082361 ecr 7082354], length 1448
20:27:05.952496 IP 10.4.3.2.5001 > 10.0.0.2.44039: Flags [.], ack 95568, win 32766, options [nop,nop,TS val 7082354 ecr 7081957,nop,nop,sack 1 {461912:479288}], length 0
20:27:05.952532 IP 10.4.3.2.5001 > 10.0.0.2.44039: Flags [.], ack 95568, win 32766, options [nop,nop,TS val 7082354 ecr 7081957,nop,nop,sack 1 {461912:480736}], length 0
20:27:05.952630 IP 10.4.3.2.5001 > 10.0.0.2.44039: Flags [.], ack 95568, win 32766, options [nop,nop,TS val 7082355 ecr 7081957,nop,nop,sack 1 {461912:482184}], length 0
20:27:05.952716 IP 10.4.3.2.5001 > 10.0.0.2.44039: Flags [.], ack 95568, win 32766, options [nop,nop,TS val 7082355 ecr 7081957,nop,nop,sack 1 {461912:483632}], length 0
20:27:05.952792 IP 10.4.3.2.5001 > 10.0.0.2.44039: Flags [.], ack 95568, win 32766, options [nop,nop,TS val 7082355 ecr 7081957,nop,nop,sack 1 {461912:485080}], length 0
20:27:05.952828 IP 10.4.3.2.5001 > 10.0.0.2.44039: Flags [.], ack 95568, win 32766, options [nop,nop,TS val 7082355 ecr 7081957,nop,nop,sack 1 {461912:486528}], length 0
20:27:05.952859 IP 10.4.3.2.5001 > 10.0.0.2.44039: Flags [.], ack 95568, win 32766, options [nop,nop,TS val 7082355 ecr 7081957,nop,nop,sack 1 {461912:487976}], length 0
20:27:05.952891 IP 10.4.3.2.5001 > 10.0.0.2.44039: Flags [.], ack 95568, win 32766, options [nop,nop,TS val 7082355 ecr 7081957,nop,nop,sack 1 {461912:489424}], length 0
20:27:05.952922 IP 10.4.3.2.5001 > 10.0.0.2.44039: Flags [.], ack 95568, win 32766, options [nop,nop,TS val 7082355 ecr 7081957,nop,nop,sack 1 {461912:490872}], length 0
20:27:05.952953 IP 10.4.3.2.5001 > 10.0.0.2.44039: Flags [.], ack 95568, win 32766, options [nop,nop,TS val 7082355 ecr 7081957,nop,nop,sack 1 {461912:492320}], length 0
20:27:05.953441 IP 10.0.0.2.44039 > 10.4.3.2.5001: Flags [.], seq 570512:571960, ack 1, win 58, options [nop,nop,TS val 7082361 ecr 7082354], length 1448
20:27:05.953517 IP 10.0.0.2.44039 > 10.4.3.2.5001: Flags [.], seq 571960:573408, ack 1, win 58, options [nop,nop,TS val 7082361 ecr 7082354], length 1448
20:27:05.953583 IP 10.0.0.2.44039 > 10.4.3.2.5001: Flags [.], seq 573408:574856, ack 1, win 58, options [nop,nop,TS val 7082361 ecr 7082354], length 1448
20:27:05.953743 IP 10.0.0.2.44039 > 10.4.3.2.5001: Flags [.], seq 574856:576304, ack 1, win 58, options [nop,nop,TS val 7082361 ecr 7082354], length 1448
20:27:05.953825 IP 10.0.0.2.44039 > 10.4.3.2.5001: Flags [.], seq 576304:579200, ack 1, win 58, options [nop,nop,TS val 7082361 ecr 7082354], length 2896
20:27:05.954189 IP 10.4.3.2.5001 > 10.0.0.2.44039: Flags [.], ack 95568, win 32766, options [nop,nop,TS val 7082355 ecr 7081957,nop,nop,sack 1 {461912:493768}], length 0
20:27:05.954224 IP 10.4.3.2.5001 > 10.0.0.2.44039: Flags [.], ack 95568, win 32766, options [nop,nop,TS val 7082356 ecr 7081957,nop,nop,sack 1 {461912:495216}], length 0
20:27:05.954305 IP 10.4.3.2.5001 > 10.0.0.2.44039: Flags [.], ack 95568, win 32766, options [nop,nop,TS val 7082356 ecr 7081957,nop,nop,sack 1 {461912:496664}], length 0
20:27:05.954363 IP 10.4.3.2.5001 > 10.0.0.2.44039: Flags [.], ack 95568, win 32766, options [nop,nop,TS val 7082356 ecr 7081957,nop,nop,sack 1 {461912:498112}], length 0
20:27:05.954449 IP 10.4.3.2.5001 > 10.0.0.2.44039: Flags [.], ack 95568, win 32766, options [nop,nop,TS val 7082356 ecr 7081957,nop,nop,sack 1 {461912:499560}], length 0
20:27:05.954482 IP 10.4.3.2.5001 > 10.0.0.2.44039: Flags [.], ack 95568, win 32766, options [nop,nop,TS val 7082356 ecr 7081957,nop,nop,sack 1 {461912:501008}], length 0
20:27:05.954561 IP 10.4.3.2.5001 > 10.0.0.2.44039: Flags [.], ack 95568, win 32766, options [nop,nop,TS val 7082356 ecr 7081957,nop,nop,sack 1 {461912:502456}], length 0
20:27:05.954594 IP 10.4.3.2.5001 > 10.0.0.2.44039: Flags [.], ack 95568, win 32766, options [nop,nop,TS val 7082356 ecr 7081957,nop,nop,sack 1 {461912:503904}], length 0
20:27:05.954625 IP 10.4.3.2.5001 > 10.0.0.2.44039: Flags [.], ack 95568, win 32766, options [nop,nop,TS val 7082356 ecr 7081957,nop,nop,sack 1 {461912:505352}], length 0
20:27:05.954674 IP 10.4.3.2.5001 > 10.0.0.2.44039: Flags [.], ack 95568, win 32766, options [nop,nop,TS val 7082356 ecr 7081957,nop,nop,sack 1 {461912:506800}], length 0
20:27:05.954707 IP 10.4.3.2.5001 > 10.0.0.2.44039: Flags [.], ack 95568, win 32766, options [nop,nop,TS val 7082356 ecr 7081957,nop,nop,sack 1 {461912:508248}], length 0
20:27:05.954738 IP 10.4.3.2.5001 > 10.0.0.2.44039: Flags [.], ack 95568, win 32766, options [nop,nop,TS val 7082356 ecr 7081957,nop,nop,sack 1 {461912:509696}], length 0
20:27:05.959509 IP 10.0.0.2.44039 > 10.4.3.2.5001: Flags [.], seq 579200:580648, ack 1, win 58, options [nop,nop,TS val 7082363 ecr 7082354], length 1448
20:27:05.959600 IP 10.0.0.2.44039 > 10.4.3.2.5001: Flags [.], seq 580648:582096, ack 1, win 58, options [nop,nop,TS val 7082363 ecr 7082354], length 1448
20:27:05.959670 IP 10.0.0.2.44039 > 10.4.3.2.5001: Flags [.], seq 582096:583544, ack 1, win 58, options [nop,nop,TS val 7082363 ecr 7082355], length 1448
20:27:05.959750 IP 10.0.0.2.44039 > 10.4.3.2.5001: Flags [.], seq 583544:584992, ack 1, win 58, options [nop,nop,TS val 7082363 ecr 7082355], length 1448
20:27:05.959908 IP 10.0.0.2.44039 > 10.4.3.2.5001: Flags [.], seq 95568:97016, ack 1, win 58, options [nop,nop,TS val 7082363 ecr 7082355], length 1448
20:27:05.960035 IP 10.0.0.2.44039 > 10.4.3.2.5001: Flags [.], seq 97016:98464, ack 1, win 58, options [nop,nop,TS val 7082363 ecr 7082355], length 1448
20:27:05.960175 IP 10.0.0.2.44039 > 10.4.3.2.5001: Flags [.], seq 98464:99912, ack 1, win 58, options [nop,nop,TS val 7082363 ecr 7082355], length 1448
20:27:05.960262 IP 10.0.0.2.44039 > 10.4.3.2.5001: Flags [.], seq 99912:101360, ack 1, win 58, options [nop,nop,TS val 7082363 ecr 7082355], length 1448
20:27:05.960378 IP 10.0.0.2.44039 > 10.4.3.2.5001: Flags [.], seq 101360:102808, ack 1, win 58, options [nop,nop,TS val 7082363 ecr 7082355], length 1448
20:27:05.960484 IP 10.0.0.2.44039 > 10.4.3.2.5001: Flags [.], seq 102808:104256, ack 1, win 58, options [nop,nop,TS val 7082363 ecr 7082355], length 1448
20:27:05.960635 IP 10.0.0.2.44039 > 10.4.3.2.5001: Flags [.], seq 104256:105704, ack 1, win 58, options [nop,nop,TS val 7082363 ecr 7082355], length 1448
20:27:05.960762 IP 10.0.0.2.44039 > 10.4.3.2.5001: Flags [.], seq 105704:107152, ack 1, win 58, options [nop,nop,TS val 7082363 ecr 7082355], length 1448
20:27:05.960901 IP 10.0.0.2.44039 > 10.4.3.2.5001: Flags [.], seq 107152:108600, ack 1, win 58, options [nop,nop,TS val 7082363 ecr 7082355], length 1448
20:27:05.961030 IP 10.0.0.2.44039 > 10.4.3.2.5001: Flags [.], seq 108600:110048, ack 1, win 58, options [nop,nop,TS val 7082363 ecr 7082355], length 1448
20:27:05.961108 IP 10.0.0.2.44039 > 10.4.3.2.5001: Flags [.], seq 110048:111496, ack 1, win 58, options [nop,nop,TS val 7082363 ecr 7082355], length 1448
20:27:05.961210 IP 10.0.0.2.44039 > 10.4.3.2.5001: Flags [.], seq 111496:112944, ack 1, win 58, options [nop,nop,TS val 7082363 ecr 7082355], length 1448
20:27:05.961395 IP 10.0.0.2.44039 > 10.4.3.2.5001: Flags [.], seq 112944:114392, ack 1, win 58, options [nop,nop,TS val 7082363 ecr 7082355], length 1448
20:27:05.961503 IP 10.0.0.2.44039 > 10.4.3.2.5001: Flags [.], seq 114392:115840, ack 1, win 58, options [nop,nop,TS val 7082363 ecr 7082355], length 1448
20:27:05.961594 IP 10.0.0.2.44039 > 10.4.3.2.5001: Flags [.], seq 115840:117288, ack 1, win 58, options [nop,nop,TS val 7082363 ecr 7082356], length 1448
20:27:05.961792 IP 10.0.0.2.44039 > 10.4.3.2.5001: Flags [.], seq 117288:118736, ack 1, win 58, options [nop,nop,TS val 7082363 ecr 7082356], length 1448
20:27:05.961887 IP 10.0.0.2.44039 > 10.4.3.2.5001: Flags [.], seq 118736:120184, ack 1, win 58, options [nop,nop,TS val 7082363 ecr 7082356], length 1448
20:27:05.961986 IP 10.0.0.2.44039 > 10.4.3.2.5001: Flags [.], seq 120184:121632, ack 1, win 58, options [nop,nop,TS val 7082363 ecr 7082356], length 1448
20:27:05.963428 IP 10.0.0.2.44039 > 10.4.3.2.5001: Flags [.], seq 121632:123080, ack 1, win 58, options [nop,nop,TS val 7082363 ecr 7082356], length 1448
20:27:05.963441 IP 10.0.0.2.44039 > 10.4.3.2.5001: Flags [.], seq 123080:124528, ack 1, win 58, options [nop,nop,TS val 7082363 ecr 7082356], length 1448
20:27:05.963560 IP 10.0.0.2.44039 > 10.4.3.2.5001: Flags [.], seq 124528:125976, ack 1, win 58, options [nop,nop,TS val 7082363 ecr 7082356], length 1448
20:27:05.963687 IP 10.0.0.2.44039 > 10.4.3.2.5001: Flags [.], seq 125976:127424, ack 1, win 58, options [nop,nop,TS val 7082363 ecr 7082356], length 1448
20:27:05.963880 IP 10.0.0.2.44039 > 10.4.3.2.5001: Flags [.], seq 127424:128872, ack 1, win 58, options [nop,nop,TS val 7082364 ecr 7082356], length 1448
20:27:05.963951 IP 10.0.0.2.44039 > 10.4.3.2.5001: Flags [.], seq 128872:130320, ack 1, win 58, options [nop,nop,TS val 7082364 ecr 7082356], length 1448
20:27:05.964162 IP 10.0.0.2.44039 > 10.4.3.2.5001: Flags [.], seq 130320:131768, ack 1, win 58, options [nop,nop,TS val 7082364 ecr 7082356], length 1448
20:27:05.964166 IP 10.0.0.2.44039 > 10.4.3.2.5001: Flags [.], seq 131768:133216, ack 1, win 58, options [nop,nop,TS val 7082364 ecr 7082356], length 1448
20:27:05.964947 IP 10.0.0.2.44039 > 10.4.3.2.5001: Flags [.], seq 133216:134664, ack 1, win 58, options [nop,nop,TS val 7082364 ecr 7082356], length 1448
20:27:05.964952 IP 10.0.0.2.44039 > 10.4.3.2.5001: Flags [.], seq 134664:136112, ack 1, win 58, options [nop,nop,TS val 7082364 ecr 7082356], length 1448
20:27:05.965185 IP 10.0.0.2.44039 > 10.4.3.2.5001: Flags [.], seq 136112:137560, ack 1, win 58, options [nop,nop,TS val 7082364 ecr 7082356], length 1448
20:27:05.965189 IP 10.0.0.2.44039 > 10.4.3.2.5001: Flags [.], seq 137560:139008, ack 1, win 58, options [nop,nop,TS val 7082364 ecr 7082356], length 1448
20:27:05.965379 IP 10.0.0.2.44039 > 10.4.3.2.5001: Flags [.], seq 139008:140456, ack 1, win 58, options [nop,nop,TS val 7082364 ecr 7082356], length 1448
20:27:05.965440 IP 10.0.0.2.44039 > 10.4.3.2.5001: Flags [.], seq 140456:141904, ack 1, win 58, options [nop,nop,TS val 7082364 ecr 7082356], length 1448
20:27:05.965572 IP 10.0.0.2.44039 > 10.4.3.2.5001: Flags [.], seq 141904:143352, ack 1, win 58, options [nop,nop,TS val 7082364 ecr 7082356], length 1448
20:27:05.965676 IP 10.0.0.2.44039 > 10.4.3.2.5001: Flags [.], seq 143352:144800, ack 1, win 58, options [nop,nop,TS val 7082364 ecr 7082356], length 1448
20:27:05.965813 IP 10.0.0.2.44039 > 10.4.3.2.5001: Flags [.], seq 144800:146248, ack 1, win 58, options [nop,nop,TS val 7082364 ecr 7082356], length 1448
20:27:05.965918 IP 10.0.0.2.44039 > 10.4.3.2.5001: Flags [.], seq 146248:147696, ack 1, win 58, options [nop,nop,TS val 7082364 ecr 7082356], length 1448
20:27:05.967010 IP 10.4.3.2.5001 > 10.0.0.2.44039: Flags [.], ack 95568, win 32766, options [nop,nop,TS val 7082358 ecr 7081957,nop,nop,sack 1 {461912:511144}], length 0
20:27:05.967093 IP 10.4.3.2.5001 > 10.0.0.2.44039: Flags [.], ack 95568, win 32766, options [nop,nop,TS val 7082358 ecr 7081957,nop,nop,sack 1 {461912:512592}], length 0
20:27:05.967128 IP 10.4.3.2.5001 > 10.0.0.2.44039: Flags [.], ack 95568, win 32766, options [nop,nop,TS val 7082358 ecr 7081957,nop,nop,sack 1 {461912:514040}], length 0
20:27:05.967218 IP 10.4.3.2.5001 > 10.0.0.2.44039: Flags [.], ack 95568, win 32766, options [nop,nop,TS val 7082358 ecr 7081957,nop,nop,sack 1 {461912:515488}], length 0
20:27:05.967250 IP 10.4.3.2.5001 > 10.0.0.2.44039: Flags [.], ack 95568, win 32766, options [nop,nop,TS val 7082358 ecr 7081957,nop,nop,sack 1 {461912:516936}], length 0
20:27:05.967338 IP 10.4.3.2.5001 > 10.0.0.2.44039: Flags [.], ack 95568, win 32766, options [nop,nop,TS val 7082358 ecr 7081957,nop,nop,sack 1 {461912:518384}], length 0
20:27:05.967370 IP 10.4.3.2.5001 > 10.0.0.2.44039: Flags [.], ack 95568, win 32766, options [nop,nop,TS val 7082359 ecr 7081957,nop,nop,sack 1 {461912:519832}], length 0
20:27:05.967459 IP 10.4.3.2.5001 > 10.0.0.2.44039: Flags [.], ack 95568, win 32766, options [nop,nop,TS val 7082359 ecr 7081957,nop,nop,sack 1 {461912:521280}], length 0
20:27:05.967492 IP 10.4.3.2.5001 > 10.0.0.2.44039: Flags [.], ack 95568, win 32766, options [nop,nop,TS val 7082359 ecr 7081957,nop,nop,sack 1 {461912:522728}], length 0
20:27:05.967596 IP 10.4.3.2.5001 > 10.0.0.2.44039: Flags [.], ack 95568, win 32766, options [nop,nop,TS val 7082359 ecr 7081957,nop,nop,sack 1 {461912:524176}], length 0
20:27:05.967629 IP 10.4.3.2.5001 > 10.0.0.2.44039: Flags [.], ack 95568, win 32766, options [nop,nop,TS val 7082359 ecr 7081957,nop,nop,sack 1 {461912:525624}], length 0
20:27:05.975425 IP 10.0.0.2.44039 > 10.4.3.2.5001: Flags [.], seq 147696:149144, ack 1, win 58, options [nop,nop,TS val 7082367 ecr 7082358], length 1448
20:27:05.975430 IP 10.0.0.2.44039 > 10.4.3.2.5001: Flags [.], seq 149144:150592, ack 1, win 58, options [nop,nop,TS val 7082367 ecr 7082358], length 1448
20:27:05.975565 IP 10.0.0.2.44039 > 10.4.3.2.5001: Flags [.], seq 150592:152040, ack 1, win 58, options [nop,nop,TS val 7082367 ecr 7082358], length 1448
20:27:05.975687 IP 10.0.0.2.44039 > 10.4.3.2.5001: Flags [.], seq 152040:153488, ack 1, win 58, options [nop,nop,TS val 7082367 ecr 7082358], length 1448
20:27:05.975820 IP 10.0.0.2.44039 > 10.4.3.2.5001: Flags [.], seq 153488:154936, ack 1, win 58, options [nop,nop,TS val 7082367 ecr 7082358], length 1448
20:27:05.975919 IP 10.0.0.2.44039 > 10.4.3.2.5001: Flags [.], seq 154936:156384, ack 1, win 58, options [nop,nop,TS val 7082367 ecr 7082358], length 1448
20:27:05.976038 IP 10.0.0.2.44039 > 10.4.3.2.5001: Flags [.], seq 156384:157832, ack 1, win 58, options [nop,nop,TS val 7082367 ecr 7082358], length 1448
20:27:05.976160 IP 10.0.0.2.44039 > 10.4.3.2.5001: Flags [.], seq 157832:159280, ack 1, win 58, options [nop,nop,TS val 7082367 ecr 7082358], length 1448
20:27:05.976331 IP 10.0.0.2.44039 > 10.4.3.2.5001: Flags [.], seq 159280:160728, ack 1, win 58, options [nop,nop,TS val 7082367 ecr 7082358], length 1448
20:27:05.976427 IP 10.0.0.2.44039 > 10.4.3.2.5001: Flags [.], seq 160728:162176, ack 1, win 58, options [nop,nop,TS val 7082367 ecr 7082358], length 1448
20:27:05.976558 IP 10.0.0.2.44039 > 10.4.3.2.5001: Flags [.], seq 162176:163624, ack 1, win 58, options [nop,nop,TS val 7082367 ecr 7082358], length 1448
20:27:05.976649 IP 10.0.0.2.44039 > 10.4.3.2.5001: Flags [.], seq 163624:165072, ack 1, win 58, options [nop,nop,TS val 7082367 ecr 7082358], length 1448
20:27:05.976806 IP 10.0.0.2.44039 > 10.4.3.2.5001: Flags [.], seq 165072:166520, ack 1, win 58, options [nop,nop,TS val 7082367 ecr 7082359], length 1448
20:27:05.976882 IP 10.0.0.2.44039 > 10.4.3.2.5001: Flags [.], seq 166520:167968, ack 1, win 58, options [nop,nop,TS val 7082367 ecr 7082359], length 1448
20:27:05.976995 IP 10.0.0.2.44039 > 10.4.3.2.5001: Flags [.], seq 167968:169416, ack 1, win 58, options [nop,nop,TS val 7082367 ecr 7082359], length 1448
20:27:05.977127 IP 10.0.0.2.44039 > 10.4.3.2.5001: Flags [.], seq 169416:170864, ack 1, win 58, options [nop,nop,TS val 7082367 ecr 7082359], length 1448
20:27:05.977302 IP 10.0.0.2.44039 > 10.4.3.2.5001: Flags [.], seq 170864:172312, ack 1, win 58, options [nop,nop,TS val 7082367 ecr 7082359], length 1448
20:27:05.977385 IP 10.0.0.2.44039 > 10.4.3.2.5001: Flags [.], seq 172312:173760, ack 1, win 58, options [nop,nop,TS val 7082367 ecr 7082359], length 1448
20:27:05.977520 IP 10.0.0.2.44039 > 10.4.3.2.5001: Flags [.], seq 173760:175208, ack 1, win 58, options [nop,nop,TS val 7082367 ecr 7082359], length 1448
20:27:05.978906 IP 10.0.0.2.44039 > 10.4.3.2.5001: Flags [.], seq 175208:176656, ack 1, win 58, options [nop,nop,TS val 7082367 ecr 7082359], length 1448
20:27:05.981843 IP 10.0.0.2.44039 > 10.4.3.2.5001: Flags [.], seq 176656:178104, ack 1, win 58, options [nop,nop,TS val 7082368 ecr 7082359], length 1448
20:27:05.981848 IP 10.0.0.2.44039 > 10.4.3.2.5001: Flags [.], seq 178104:179552, ack 1, win 58, options [nop,nop,TS val 7082368 ecr 7082359], length 1448
20:27:05.983617 IP 10.4.3.2.5001 > 10.0.0.2.44039: Flags [.], ack 95568, win 32766, options [nop,nop,TS val 7082359 ecr 7081957,nop,nop,sack 1 {461912:527072}], length 0
20:27:05.983654 IP 10.4.3.2.5001 > 10.0.0.2.44039: Flags [.], ack 95568, win 32766, options [nop,nop,TS val 7082359 ecr 7081957,nop,nop,sack 1 {461912:528520}], length 0
20:27:05.983686 IP 10.4.3.2.5001 > 10.0.0.2.44039: Flags [.], ack 95568, win 32766, options [nop,nop,TS val 7082359 ecr 7081957,nop,nop,sack 1 {461912:529968}], length 0
20:27:05.983718 IP 10.4.3.2.5001 > 10.0.0.2.44039: Flags [.], ack 95568, win 32766, options [nop,nop,TS val 7082359 ecr 7081957,nop,nop,sack 1 {461912:531416}], length 0
20:27:05.992754 IP 10.4.3.2.5001 > 10.0.0.2.44039: Flags [.], ack 95568, win 32766, options [nop,nop,TS val 7082359 ecr 7081957,nop,nop,sack 1 {461912:532864}], length 0
20:27:05.992851 IP 10.4.3.2.5001 > 10.0.0.2.44039: Flags [.], ack 95568, win 32766, options [nop,nop,TS val 7082359 ecr 7081957,nop,nop,sack 1 {461912:534312}], length 0
20:27:05.992903 IP 10.4.3.2.5001 > 10.0.0.2.44039: Flags [.], ack 95568, win 32766, options [nop,nop,TS val 7082359 ecr 7081957,nop,nop,sack 1 {461912:535760}], length 0
20:27:05.992958 IP 10.4.3.2.5001 > 10.0.0.2.44039: Flags [.], ack 95568, win 32766, options [nop,nop,TS val 7082359 ecr 7081957,nop,nop,sack 1 {461912:537208}], length 0
20:27:05.992990 IP 10.4.3.2.5001 > 10.0.0.2.44039: Flags [.], ack 95568, win 32766, options [nop,nop,TS val 7082359 ecr 7081957,nop,nop,sack 1 {461912:538656}], length 0
20:27:05.993060 IP 10.4.3.2.5001 > 10.0.0.2.44039: Flags [.], ack 95568, win 32766, options [nop,nop,TS val 7082359 ecr 7081957,nop,nop,sack 1 {461912:540104}], length 0
20:27:05.993093 IP 10.4.3.2.5001 > 10.0.0.2.44039: Flags [.], ack 95568, win 32766, options [nop,nop,TS val 7082359 ecr 7081957,nop,nop,sack 1 {461912:541552}], length 0
20:27:05.993126 IP 10.4.3.2.5001 > 10.0.0.2.44039: Flags [.], ack 95568, win 32766, options [nop,nop,TS val 7082359 ecr 7081957,nop,nop,sack 1 {461912:543000}], length 0
20:27:05.993157 IP 10.4.3.2.5001 > 10.0.0.2.44039: Flags [.], ack 95568, win 32766, options [nop,nop,TS val 7082359 ecr 7081957,nop,nop,sack 1 {461912:544448}], length 0
20:27:05.993189 IP 10.4.3.2.5001 > 10.0.0.2.44039: Flags [.], ack 95568, win 32766, options [nop,nop,TS val 7082361 ecr 7081957,nop,nop,sack 1 {461912:545896}], length 0
20:27:05.993845 IP 10.0.0.2.44039 > 10.4.3.2.5001: Flags [.], seq 179552:181000, ack 1, win 58, options [nop,nop,TS val 7082371 ecr 7082359], length 1448
20:27:05.993850 IP 10.0.0.2.44039 > 10.4.3.2.5001: Flags [.], seq 181000:182448, ack 1, win 58, options [nop,nop,TS val 7082371 ecr 7082359], length 1448
20:27:05.993977 IP 10.0.0.2.44039 > 10.4.3.2.5001: Flags [.], seq 182448:183896, ack 1, win 58, options [nop,nop,TS val 7082371 ecr 7082359], length 1448
20:27:05.994112 IP 10.0.0.2.44039 > 10.4.3.2.5001: Flags [.], seq 183896:185344, ack 1, win 58, options [nop,nop,TS val 7082371 ecr 7082359], length 1448
20:27:05.994340 IP 10.0.0.2.44039 > 10.4.3.2.5001: Flags [.], seq 185344:186792, ack 1, win 58, options [nop,nop,TS val 7082371 ecr 7082359], length 1448
20:27:05.994345 IP 10.0.0.2.44039 > 10.4.3.2.5001: Flags [.], seq 186792:188240, ack 1, win 58, options [nop,nop,TS val 7082371 ecr 7082359], length 1448
20:27:05.994486 IP 10.0.0.2.44039 > 10.4.3.2.5001: Flags [.], seq 188240:189688, ack 1, win 58, options [nop,nop,TS val 7082371 ecr 7082359], length 1448
20:27:05.994602 IP 10.0.0.2.44039 > 10.4.3.2.5001: Flags [.], seq 189688:191136, ack 1, win 58, options [nop,nop,TS val 7082372 ecr 7082359], length 1448
20:27:05.995344 IP 10.4.3.2.5001 > 10.0.0.2.44039: Flags [.], ack 95568, win 32766, options [nop,nop,TS val 7082361 ecr 7081957,nop,nop,sack 1 {461912:547344}], length 0
20:27:05.995381 IP 10.4.3.2.5001 > 10.0.0.2.44039: Flags [.], ack 95568, win 32766, options [nop,nop,TS val 7082361 ecr 7081957,nop,nop,sack 1 {461912:548792}], length 0
20:27:05.995414 IP 10.4.3.2.5001 > 10.0.0.2.44039: Flags [.], ack 95568, win 32766, options [nop,nop,TS val 7082361 ecr 7081957,nop,nop,sack 1 {461912:550240}], length 0
20:27:05.995449 IP 10.4.3.2.5001 > 10.0.0.2.44039: Flags [.], ack 95568, win 32766, options [nop,nop,TS val 7082361 ecr 7081957,nop,nop,sack 1 {461912:551688}], length 0
20:27:05.995481 IP 10.4.3.2.5001 > 10.0.0.2.44039: Flags [.], ack 95568, win 32766, options [nop,nop,TS val 7082361 ecr 7081957,nop,nop,sack 1 {461912:553136}], length 0
20:27:05.995514 IP 10.4.3.2.5001 > 10.0.0.2.44039: Flags [.], ack 95568, win 32766, options [nop,nop,TS val 7082361 ecr 7081957,nop,nop,sack 1 {461912:554584}], length 0
20:27:05.995561 IP 10.4.3.2.5001 > 10.0.0.2.44039: Flags [.], ack 95568, win 32766, options [nop,nop,TS val 7082361 ecr 7081957,nop,nop,sack 1 {461912:556032}], length 0
20:27:05.995595 IP 10.4.3.2.5001 > 10.0.0.2.44039: Flags [.], ack 95568, win 32766, options [nop,nop,TS val 7082361 ecr 7081957,nop,nop,sack 1 {461912:557480}], length 0
20:27:05.995628 IP 10.4.3.2.5001 > 10.0.0.2.44039: Flags [.], ack 95568, win 32766, options [nop,nop,TS val 7082362 ecr 7081957,nop,nop,sack 1 {461912:558928}], length 0
20:27:05.996301 IP 10.0.0.2.44039 > 10.4.3.2.5001: Flags [.], seq 191136:192584, ack 1, win 58, options [nop,nop,TS val 7082372 ecr 7082359], length 1448
20:27:05.996306 IP 10.0.0.2.44039 > 10.4.3.2.5001: Flags [.], seq 192584:194032, ack 1, win 58, options [nop,nop,TS val 7082372 ecr 7082359], length 1448
20:27:05.996488 IP 10.0.0.2.44039 > 10.4.3.2.5001: Flags [.], seq 194032:195480, ack 1, win 58, options [nop,nop,TS val 7082372 ecr 7082359], length 1448
20:27:05.996560 IP 10.0.0.2.44039 > 10.4.3.2.5001: Flags [.], seq 195480:196928, ack 1, win 58, options [nop,nop,TS val 7082372 ecr 7082359], length 1448
20:27:05.996671 IP 10.0.0.2.44039 > 10.4.3.2.5001: Flags [.], seq 196928:198376, ack 1, win 58, options [nop,nop,TS val 7082372 ecr 7082359], length 1448
20:27:05.996791 IP 10.0.0.2.44039 > 10.4.3.2.5001: Flags [.], seq 198376:199824, ack 1, win 58, options [nop,nop,TS val 7082372 ecr 7082359], length 1448
20:27:05.996980 IP 10.0.0.2.44039 > 10.4.3.2.5001: Flags [.], seq 199824:201272, ack 1, win 58, options [nop,nop,TS val 7082372 ecr 7082359], length 1448
20:27:05.997048 IP 10.0.0.2.44039 > 10.4.3.2.5001: Flags [.], seq 201272:202720, ack 1, win 58, options [nop,nop,TS val 7082372 ecr 7082359], length 1448
20:27:05.997204 IP 10.0.0.2.44039 > 10.4.3.2.5001: Flags [.], seq 202720:204168, ack 1, win 58, options [nop,nop,TS val 7082372 ecr 7082359], length 1448
20:27:05.997288 IP 10.0.0.2.44039 > 10.4.3.2.5001: Flags [.], seq 204168:205616, ack 1, win 58, options [nop,nop,TS val 7082372 ecr 7082359], length 1448
20:27:05.997390 IP 10.0.0.2.44039 > 10.4.3.2.5001: Flags [.], seq 205616:207064, ack 1, win 58, options [nop,nop,TS val 7082372 ecr 7082359], length 1448
20:27:05.997528 IP 10.0.0.2.44039 > 10.4.3.2.5001: Flags [.], seq 207064:208512, ack 1, win 58, options [nop,nop,TS val 7082372 ecr 7082359], length 1448
20:27:06.001224 IP 10.0.0.2.44039 > 10.4.3.2.5001: Flags [.], seq 208512:209960, ack 1, win 58, options [nop,nop,TS val 7082373 ecr 7082359], length 1448
20:27:06.001236 IP 10.0.0.2.44039 > 10.4.3.2.5001: Flags [.], seq 209960:211408, ack 1, win 58, options [nop,nop,TS val 7082373 ecr 7082359], length 1448
20:27:06.001441 IP 10.0.0.2.44039 > 10.4.3.2.5001: Flags [.], seq 211408:212856, ack 1, win 58, options [nop,nop,TS val 7082373 ecr 7082359], length 1448
20:27:06.001524 IP 10.0.0.2.44039 > 10.4.3.2.5001: Flags [.], seq 212856:214304, ack 1, win 58, options [nop,nop,TS val 7082373 ecr 7082359], length 1448
20:27:06.001622 IP 10.0.0.2.44039 > 10.4.3.2.5001: Flags [.], seq 214304:215752, ack 1, win 58, options [nop,nop,TS val 7082373 ecr 7082359], length 1448
20:27:06.001726 IP 10.0.0.2.44039 > 10.4.3.2.5001: Flags [.], seq 215752:217200, ack 1, win 58, options [nop,nop,TS val 7082373 ecr 7082359], length 1448
20:27:06.001898 IP 10.0.0.2.44039 > 10.4.3.2.5001: Flags [.], seq 217200:218648, ack 1, win 58, options [nop,nop,TS val 7082373 ecr 7082361], length 1448
20:27:06.001960 IP 10.0.0.2.44039 > 10.4.3.2.5001: Flags [.], seq 218648:220096, ack 1, win 58, options [nop,nop,TS val 7082373 ecr 7082361], length 1448
20:27:06.004135 IP 10.4.3.2.5001 > 10.0.0.2.44039: Flags [.], ack 95568, win 32766, options [nop,nop,TS val 7082363 ecr 7081957,nop,nop,sack 1 {461912:560376}], length 0
20:27:06.004177 IP 10.4.3.2.5001 > 10.0.0.2.44039: Flags [.], ack 95568, win 32766, options [nop,nop,TS val 7082363 ecr 7081957,nop,nop,sack 1 {461912:561824}], length 0
20:27:06.004209 IP 10.4.3.2.5001 > 10.0.0.2.44039: Flags [.], ack 95568, win 32766, options [nop,nop,TS val 7082363 ecr 7081957,nop,nop,sack 1 {461912:563272}], length 0
20:27:06.004240 IP 10.4.3.2.5001 > 10.0.0.2.44039: Flags [.], ack 95568, win 32766, options [nop,nop,TS val 7082363 ecr 7081957,nop,nop,sack 1 {461912:564720}], length 0
20:27:06.004272 IP 10.4.3.2.5001 > 10.0.0.2.44039: Flags [.], ack 95568, win 32766, options [nop,nop,TS val 7082363 ecr 7081957,nop,nop,sack 1 {461912:566168}], length 0
20:27:06.004303 IP 10.4.3.2.5001 > 10.0.0.2.44039: Flags [.], ack 95568, win 32766, options [nop,nop,TS val 7082363 ecr 7081957,nop,nop,sack 1 {461912:567616}], length 0
20:27:06.007206 IP 10.0.0.2.44039 > 10.4.3.2.5001: Flags [.], seq 220096:221544, ack 1, win 58, options [nop,nop,TS val 7082375 ecr 7082361], length 1448
20:27:06.007211 IP 10.0.0.2.44039 > 10.4.3.2.5001: Flags [.], seq 221544:222992, ack 1, win 58, options [nop,nop,TS val 7082375 ecr 7082361], length 1448
20:27:06.007403 IP 10.0.0.2.44039 > 10.4.3.2.5001: Flags [.], seq 222992:224440, ack 1, win 58, options [nop,nop,TS val 7082375 ecr 7082361], length 1448
20:27:06.007468 IP 10.0.0.2.44039 > 10.4.3.2.5001: Flags [.], seq 224440:225888, ack 1, win 58, options [nop,nop,TS val 7082375 ecr 7082361], length 1448
20:27:06.007580 IP 10.0.0.2.44039 > 10.4.3.2.5001: Flags [.], seq 225888:227336, ack 1, win 58, options [nop,nop,TS val 7082375 ecr 7082361], length 1448
20:27:06.007712 IP 10.0.0.2.44039 > 10.4.3.2.5001: Flags [.], seq 227336:228784, ack 1, win 58, options [nop,nop,TS val 7082375 ecr 7082361], length 1448
20:27:06.007821 IP 10.0.0.2.44039 > 10.4.3.2.5001: Flags [.], seq 228784:230232, ack 1, win 58, options [nop,nop,TS val 7082375 ecr 7082361], length 1448
20:27:06.007950 IP 10.0.0.2.44039 > 10.4.3.2.5001: Flags [.], seq 230232:231680, ack 1, win 58, options [nop,nop,TS val 7082375 ecr 7082361], length 1448
20:27:06.008070 IP 10.0.0.2.44039 > 10.4.3.2.5001: Flags [.], seq 231680:233128, ack 1, win 58, options [nop,nop,TS val 7082375 ecr 7082361], length 1448
20:27:06.008196 IP 10.0.0.2.44039 > 10.4.3.2.5001: Flags [.], seq 233128:234576, ack 1, win 58, options [nop,nop,TS val 7082375 ecr 7082361], length 1448
20:27:06.008351 IP 10.0.0.2.44039 > 10.4.3.2.5001: Flags [.], seq 234576:236024, ack 1, win 58, options [nop,nop,TS val 7082375 ecr 7082361], length 1448
20:27:06.008433 IP 10.0.0.2.44039 > 10.4.3.2.5001: Flags [.], seq 236024:237472, ack 1, win 58, options [nop,nop,TS val 7082375 ecr 7082361], length 1448
20:27:06.008536 IP 10.0.0.2.44039 > 10.4.3.2.5001: Flags [.], seq 237472:238920, ack 1, win 58, options [nop,nop,TS val 7082375 ecr 7082361], length 1448
20:27:06.008790 IP 10.0.0.2.44039 > 10.4.3.2.5001: Flags [.], seq 238920:240368, ack 1, win 58, options [nop,nop,TS val 7082375 ecr 7082361], length 1448
20:27:06.008797 IP 10.0.0.2.44039 > 10.4.3.2.5001: Flags [.], seq 240368:241816, ack 1, win 58, options [nop,nop,TS val 7082375 ecr 7082361], length 1448
20:27:06.008937 IP 10.0.0.2.44039 > 10.4.3.2.5001: Flags [.], seq 241816:243264, ack 1, win 58, options [nop,nop,TS val 7082375 ecr 7082361], length 1448
20:27:06.009038 IP 10.0.0.2.44039 > 10.4.3.2.5001: Flags [.], seq 243264:244712, ack 1, win 58, options [nop,nop,TS val 7082375 ecr 7082362], length 1448
20:27:06.009164 IP 10.0.0.2.44039 > 10.4.3.2.5001: Flags [.], seq 244712:246160, ack 1, win 58, options [nop,nop,TS val 7082375 ecr 7082362], length 1448
20:27:06.012109 IP 10.4.3.2.5001 > 10.0.0.2.44039: Flags [.], ack 95568, win 32766, options [nop,nop,TS val 7082366 ecr 7081957,nop,nop,sack 1 {461912:569064}], length 0
20:27:06.013353 IP 10.0.0.2.44039 > 10.4.3.2.5001: Flags [.], seq 246160:247608, ack 1, win 58, options [nop,nop,TS val 7082376 ecr 7082363], length 1448
20:27:06.013357 IP 10.0.0.2.44039 > 10.4.3.2.5001: Flags [.], seq 247608:249056, ack 1, win 58, options [nop,nop,TS val 7082376 ecr 7082363], length 1448
20:27:06.013507 IP 10.0.0.2.44039 > 10.4.3.2.5001: Flags [.], seq 249056:250504, ack 1, win 58, options [nop,nop,TS val 7082376 ecr 7082363], length 1448
20:27:06.013629 IP 10.0.0.2.44039 > 10.4.3.2.5001: Flags [.], seq 250504:251952, ack 1, win 58, options [nop,nop,TS val 7082376 ecr 7082363], length 1448
20:27:06.013764 IP 10.0.0.2.44039 > 10.4.3.2.5001: Flags [.], seq 251952:253400, ack 1, win 58, options [nop,nop,TS val 7082376 ecr 7082363], length 1448
20:27:06.013852 IP 10.0.0.2.44039 > 10.4.3.2.5001: Flags [.], seq 253400:254848, ack 1, win 58, options [nop,nop,TS val 7082376 ecr 7082363], length 1448
20:27:06.014966 IP 10.0.0.2.44039 > 10.4.3.2.5001: Flags [.], seq 254848:256296, ack 1, win 58, options [nop,nop,TS val 7082376 ecr 7082363], length 1448
20:27:06.014971 IP 10.0.0.2.44039 > 10.4.3.2.5001: Flags [.], seq 256296:257744, ack 1, win 58, options [nop,nop,TS val 7082376 ecr 7082363], length 1448
20:27:06.018502 IP 10.0.0.2.44039 > 10.4.3.2.5001: Flags [.], seq 257744:259192, ack 1, win 58, options [nop,nop,TS val 7082378 ecr 7082363], length 1448
20:27:06.018506 IP 10.0.0.2.44039 > 10.4.3.2.5001: Flags [.], seq 259192:260640, ack 1, win 58, options [nop,nop,TS val 7082378 ecr 7082363], length 1448
20:27:06.018629 IP 10.0.0.2.44039 > 10.4.3.2.5001: Flags [.], seq 260640:262088, ack 1, win 58, options [nop,nop,TS val 7082378 ecr 7082363], length 1448
20:27:06.018763 IP 10.0.0.2.44039 > 10.4.3.2.5001: Flags [.], seq 262088:263536, ack 1, win 58, options [nop,nop,TS val 7082378 ecr 7082363], length 1448
20:27:06.025746 IP 10.0.0.2.44039 > 10.4.3.2.5001: Flags [.], seq 263536:264984, ack 1, win 58, options [nop,nop,TS val 7082379 ecr 7082366], length 1448
20:27:06.025752 IP 10.0.0.2.44039 > 10.4.3.2.5001: Flags [.], seq 264984:266432, ack 1, win 58, options [nop,nop,TS val 7082379 ecr 7082366], length 1448
20:27:06.026101 IP 10.4.3.2.5001 > 10.0.0.2.44039: Flags [.], ack 95568, win 32766, options [nop,nop,TS val 7082366 ecr 7081957,nop,nop,sack 1 {461912:570512}], length 0
20:27:06.026160 IP 10.4.3.2.5001 > 10.0.0.2.44039: Flags [.], ack 95568, win 32766, options [nop,nop,TS val 7082366 ecr 7081957,nop,nop,sack 1 {461912:571960}], length 0
20:27:06.026171 IP 10.4.3.2.5001 > 10.0.0.2.44039: Flags [.], ack 95568, win 32766, options [nop,nop,TS val 7082366 ecr 7081957,nop,nop,sack 1 {461912:573408}], length 0
20:27:06.026180 IP 10.4.3.2.5001 > 10.0.0.2.44039: Flags [.], ack 95568, win 32766, options [nop,nop,TS val 7082366 ecr 7081957,nop,nop,sack 1 {461912:574856}], length 0
20:27:06.026189 IP 10.4.3.2.5001 > 10.0.0.2.44039: Flags [.], ack 95568, win 32766, options [nop,nop,TS val 7082366 ecr 7081957,nop,nop,sack 1 {461912:576304}], length 0
20:27:06.026199 IP 10.4.3.2.5001 > 10.0.0.2.44039: Flags [.], ack 95568, win 32766, options [nop,nop,TS val 7082366 ecr 7081957,nop,nop,sack 1 {461912:577752}], length 0
20:27:06.026208 IP 10.4.3.2.5001 > 10.0.0.2.44039: Flags [.], ack 95568, win 32766, options [nop,nop,TS val 7082366 ecr 7081957,nop,nop,sack 1 {461912:579200}], length 0
20:27:06.032349 IP 10.4.3.2.5001 > 10.0.0.2.44039: Flags [.], ack 95568, win 32766, options [nop,nop,TS val 7082368 ecr 7081957,nop,nop,sack 1 {461912:580648}], length 0
20:27:06.032367 IP 10.4.3.2.5001 > 10.0.0.2.44039: Flags [.], ack 95568, win 32766, options [nop,nop,TS val 7082369 ecr 7081957,nop,nop,sack 1 {461912:582096}], length 0
20:27:06.032376 IP 10.4.3.2.5001 > 10.0.0.2.44039: Flags [.], ack 95568, win 32766, options [nop,nop,TS val 7082369 ecr 7081957,nop,nop,sack 1 {461912:583544}], length 0
20:27:06.032386 IP 10.4.3.2.5001 > 10.0.0.2.44039: Flags [.], ack 95568, win 32766, options [nop,nop,TS val 7082369 ecr 7081957,nop,nop,sack 1 {461912:584992}], length 0
20:27:06.032395 IP 10.4.3.2.5001 > 10.0.0.2.44039: Flags [.], ack 97016, win 32764, options [nop,nop,TS val 7082369 ecr 7082363,nop,nop,sack 1 {461912:584992}], length 0
20:27:06.032405 IP 10.4.3.2.5001 > 10.0.0.2.44039: Flags [.], ack 98464, win 32762, options [nop,nop,TS val 7082369 ecr 7082363,nop,nop,sack 1 {461912:584992}], length 0
20:27:06.032429 IP 10.4.3.2.5001 > 10.0.0.2.44039: Flags [.], ack 99912, win 32760, options [nop,nop,TS val 7082369 ecr 7082363,nop,nop,sack 1 {461912:584992}], length 0
20:27:06.032439 IP 10.4.3.2.5001 > 10.0.0.2.44039: Flags [.], ack 101360, win 32758, options [nop,nop,TS val 7082369 ecr 7082363,nop,nop,sack 1 {461912:584992}], length 0
20:27:06.032449 IP 10.4.3.2.5001 > 10.0.0.2.44039: Flags [.], ack 102808, win 32756, options [nop,nop,TS val 7082369 ecr 7082363,nop,nop,sack 1 {461912:584992}], length 0
20:27:06.032466 IP 10.4.3.2.5001 > 10.0.0.2.44039: Flags [.], ack 104256, win 32754, options [nop,nop,TS val 7082369 ecr 7082363,nop,nop,sack 1 {461912:584992}], length 0
20:27:06.032493 IP 10.4.3.2.5001 > 10.0.0.2.44039: Flags [.], ack 105704, win 32752, options [nop,nop,TS val 7082369 ecr 7082363,nop,nop,sack 1 {461912:584992}], length 0
20:27:06.032503 IP 10.4.3.2.5001 > 10.0.0.2.44039: Flags [.], ack 107152, win 32750, options [nop,nop,TS val 7082369 ecr 7082363,nop,nop,sack 1 {461912:584992}], length 0
20:27:06.034829 IP 10.4.3.2.5001 > 10.0.0.2.44039: Flags [.], ack 108600, win 32748, options [nop,nop,TS val 7082369 ecr 7082363,nop,nop,sack 1 {461912:584992}], length 0
20:27:06.034862 IP 10.4.3.2.5001 > 10.0.0.2.44039: Flags [.], ack 110048, win 32746, options [nop,nop,TS val 7082370 ecr 7082363,nop,nop,sack 1 {461912:584992}], length 0
20:27:06.034873 IP 10.4.3.2.5001 > 10.0.0.2.44039: Flags [.], ack 111496, win 32744, options [nop,nop,TS val 7082370 ecr 7082363,nop,nop,sack 1 {461912:584992}], length 0
20:27:06.034882 IP 10.4.3.2.5001 > 10.0.0.2.44039: Flags [.], ack 112944, win 32742, options [nop,nop,TS val 7082370 ecr 7082363,nop,nop,sack 1 {461912:584992}], length 0
20:27:06.034891 IP 10.4.3.2.5001 > 10.0.0.2.44039: Flags [.], ack 114392, win 32740, options [nop,nop,TS val 7082371 ecr 7082363,nop,nop,sack 1 {461912:584992}], length 0
20:27:06.034900 IP 10.4.3.2.5001 > 10.0.0.2.44039: Flags [.], ack 115840, win 32738, options [nop,nop,TS val 7082371 ecr 7082363,nop,nop,sack 1 {461912:584992}], length 0
20:27:06.034909 IP 10.4.3.2.5001 > 10.0.0.2.44039: Flags [.], ack 117288, win 32736, options [nop,nop,TS val 7082371 ecr 7082363,nop,nop,sack 1 {461912:584992}], length 0
20:27:06.034918 IP 10.4.3.2.5001 > 10.0.0.2.44039: Flags [.], ack 118736, win 32734, options [nop,nop,TS val 7082371 ecr 7082363,nop,nop,sack 1 {461912:584992}], length 0
20:27:06.034944 IP 10.4.3.2.5001 > 10.0.0.2.44039: Flags [.], ack 120184, win 32732, options [nop,nop,TS val 7082371 ecr 7082363,nop,nop,sack 1 {461912:584992}], length 0
20:27:06.034961 IP 10.4.3.2.5001 > 10.0.0.2.44039: Flags [.], ack 121632, win 32730, options [nop,nop,TS val 7082371 ecr 7082363,nop,nop,sack 1 {461912:584992}], length 0
20:27:06.034971 IP 10.4.3.2.5001 > 10.0.0.2.44039: Flags [.], ack 123080, win 32728, options [nop,nop,TS val 7082371 ecr 7082363,nop,nop,sack 1 {461912:584992}], length 0
20:27:06.035164 IP 10.0.0.2.44039 > 10.4.3.2.5001: Flags [.], seq 266432:267880, ack 1, win 58, options [nop,nop,TS val 7082382 ecr 7082366], length 1448
